{
  "schemaVersion": "1.0.0",
  "appId": "neutralization-simulator",
  "title": "酸・アルカリ・中和シミュレーター",
  "version": "1.0.0",
  "status": "active",
  "level": "C",
  "education": {
    "schoolStage": "mixed",
    "subjects": [
      "science",
      "chemistry"
    ],
    "grades": [
      "JH3",
      "SH1"
    ],
    "units": [
      "JH3.CHEM.ACID-BASE-NEUTRALIZATION",
      "SH1.CHEM.ACID-BASE-TITRATION"
    ],
    "appTypes": [
      "simulation",
      "experiment",
      "visualization"
    ],
    "learningGoals": [
      "酸性・アルカリ性の水溶液を混合したときのpH変化を説明できる。",
      "酸と塩基の種類、濃度、体積を変えて中和の条件を比較できる。",
      "粒子モデルと滴定曲線を関連付けて反応の進行を理解できる。"
    ],
    "useCases": [
      "lesson-introduction",
      "lesson-practice",
      "experiment-prep",
      "experiment-review",
      "home-study",
      "teacher-demo"
    ],
    "modelLimitations": [
      "学習用の近似モデルであり、実験結果を完全に再現するものではない。",
      "高濃度では活量を無視している。",
      "弱酸・弱塩基および硫酸は高校化学基礎レベルの近似を用いている。",
      "粒子数と粒子配置は概念理解のために単純化して表示している。"
    ]
  },
  "platform": {
    "sourceDependencyMode": "self-contained",
    "coreVersion": null,
    "referenceImplementations": []
  },
  "distribution": {
    "hosted": {
      "enabled": true,
      "dependencyMode": "self-contained"
    },
    "portable": {
      "enabled": true,
      "dependencyMode": "self-contained",
      "directFileOpen": true
    },
    "standalonePackage": {
      "enabled": true,
      "dependencyMode": "self-contained"
    }
  },
  "storage": {
    "enabled": false,
    "types": [],
    "deletionMethod": "保存データはありません。"
  },
  "network": {
    "required": false,
    "externalEndpoints": []
  },
  "privacy": {
    "collectsPersonalData": false,
    "usesAnalytics": false,
    "usesCookies": false,
    "externalTransmission": false
  },
  "accessibility": {
    "keyboardSupported": true,
    "dragAlternativeProvided": true,
    "colorIndependentFeedback": true,
    "reducedMotionSupported": true
  },
  "license": {
    "code": "TBD",
    "content": "TBD",
    "thirdPartyNotices": []
  },
  "owners": {
    "appOwnerRole": "Neutralization Simulator App Owner",
    "maintainerRole": "You Science Apps Platform Maintainer"
  },
  "links": {
    "hostedUrl": "./apps/junior-high/chemistry/neutralization-simulator/",
    "repositoryPath": "site/apps/junior-high/chemistry/neutralization-simulator"
  }
}
